{
  "failures": 3,
  "mode": "fixture",
  "patches": 1,
  "provenance": {
    "client": "FixtureLLMClient",
    "created_at": "2026-07-12T00:00:00Z",
    "mode": "fixture",
    "producer": "fixture",
    "run_id": "RUN-001",
    "schema_version": "2026-07-12.1",
    "source_artifact_ids": [
      "ART-001"
    ],
    "validation_status": "validated"
  },
  "requirements": 3,
  "run_id": "RUN-001",
  "tests": 3
}
